{
  "schema": "epistates/audit-result/v1",
  "task_id": "e1-contracts",
  "run_id": "run-001",
  "attempt_id": "attempt-001",
  "task_card_digest": "sha256:c14c033bd0e001a4db801f99e5ab60dc75dee7c4ca597305740124e95113d3c9",
  "authority_binding": {
    "grant_id": "maintainer-e1-contracts",
    "grant_digest": "sha256:24a39dff4b7a38f45959b89850debed2bb584fb4c887278748064ed6f1eda2cd",
    "decision_reference": "conversation-2026-08-11"
  },
  "observed_at": "2026-08-11T19:00:00Z",
  "state_before": "REVIEWING",
  "classification": "OK",
  "decision": "proceed",
  "review_evidence_digest": "sha256:1bf6b84ca1d8778452f78a83a30a5c5837e946277143aff08a995790c2c9bfd1",
  "evidence": [
    {"evidence_id": "diff_check", "status": "pass", "digest": "sha256:bbbbbbbbbbbbbbbbbbbbbbbbbbbbbbbbbbbbbbbbbbbbbbbbbbbbbbbbbbbbbbbb"},
    {"evidence_id": "git_status", "status": "pass", "digest": "sha256:cccccccccccccccccccccccccccccccccccccccccccccccccccccccccccccccc"},
    {"evidence_id": "unit_tests", "status": "pass", "digest": "sha256:dddddddddddddddddddddddddddddddddddddddddddddddddddddddddddddddd"},
    {"evidence_id": "capture", "status": "pass", "digest": "sha256:aaaaaaaaaaaaaaaaaaaaaaaaaaaaaaaaaaaaaaaaaaaaaaaaaaaaaaaaaaaaaaaa"}
  ]
}
